{
  "schema_version": 1,
  "id": "CHG-20261021-002",
  "title": "Record ADR 0017's approval in full (D23), audit its implementation and tighten the fallback-width test",
  "actor": "Claude Code agent (architect/QA reviewer role) on Director request, local WSL session",
  "status": "finalized",
  "recorded_at": "2026-10-21T07:01:59.323Z",
  "occurred_at": null,
  "event_time_basis": "recorded_only",
  "source_commit": "2c847692128d752aebb7b4a2340f3a34cd148965",
  "task_ids": [
    "UX-01",
    "UX-03",
    "DOC-01",
    "DOC-02"
  ],
  "requirement_ids": [],
  "feature_ids": [
    "F-DESIGN-SYSTEM",
    "F-DOCS"
  ],
  "changes": [
    {
      "kind": "documentation",
      "description": "Decision D23: the Director approved ADR 0017 in its entirety, with the icon and font guidelines (D20, D21) governing where they differ, and required it implemented in full; this corrects D22's reading of 'other changes'. ADR 0017's status line and interpretations section record the approval."
    },
    {
      "kind": "review",
      "description": "Implementation audit of every ADR 0017 decision item, interpretation and consequence against the code, recorded as a table in the ADR: all implemented; the authored icon family is superseded by D21; animation speed is bounded in the preference model as the ADR states, and applying it to choreography belongs to packages/presentation (§32)."
    },
    {
      "kind": "fix",
      "description": "The ADR's font-metrics consequence (about 4.5% width difference) was a Linux hinting artifact: with hinting off the measured fallback is within +1.2% of Source Sans 3 (639.5 px against 631.9 px; hinted 622 px against 651 px). The browser test bound tightens from 5% to 2%."
    },
    {
      "kind": "test",
      "description": "RUN-20261021-005 (configuration and workflow checks, pnpm audit clean, typecheck, lint, full suite: 403 Node, 26 Python, upstream 406/1 skip, 2 injection) passes at fingerprint 52f4cc01."
    },
    {
      "kind": "test",
      "description": "RUN-20261021-006: isolated design-system suite passed in 117 s (34 gates, Chromium install, 161/161, including the tightened 2% width bound) at fingerprint 52f4cc01."
    }
  ],
  "files": [
    "AGENTS.md",
    "CHANGELOG.md",
    "README.md",
    "docs/FEATURES.md",
    "docs/HANDOFF.md",
    "docs/README.md",
    "docs/adr/0017-technical-design-system.md",
    "docs/changes/CHG-20261021-002.json",
    "docs/current-state.json",
    "docs/features.json",
    "docs/validation/logs/RUN-20261021-005.txt",
    "docs/validation/logs/RUN-20261021-006.txt",
    "docs/validation/logs/RUN-20261021-007.txt",
    "docs/validation/runs/RUN-20261021-005.json",
    "docs/validation/runs/RUN-20261021-006.json",
    "docs/validation/runs/RUN-20261021-007.json",
    "docs/validation/ux-design-system.md",
    "docs/vision/decision_register.csv",
    "packages/design-system/tests/browser/interactions.spec.ts"
  ],
  "documentation_reviews": [
    {
      "path": "AGENTS.md",
      "disposition": "updated",
      "reason": "UX-01 status line: ADR 0017 approved in full (D23); audit found every item implemented."
    },
    {
      "path": "README.md",
      "disposition": "updated",
      "reason": "Same status-line addition as AGENTS.md."
    },
    {
      "path": "docs/README.md",
      "disposition": "updated",
      "reason": "Same status-line addition as AGENTS.md."
    },
    {
      "path": "docs/adr/0017-technical-design-system.md",
      "disposition": "updated",
      "reason": "Status line: approved in full (D23). Interpretations marked approved. Dated section: implementation audit table, corrected font-metrics finding, animation-speed boundary."
    },
    {
      "path": "docs/vision/decision_register.csv",
      "disposition": "updated",
      "reason": "New D23: ADR 0017 approved in full, correcting D22."
    },
    {
      "path": "docs/validation/ux-design-system.md",
      "disposition": "updated",
      "reason": "Dated section: the approval, the audit result, the corrected width finding and receipts."
    },
    {
      "path": "docs/features.json",
      "disposition": "updated",
      "reason": "Every verified feature cites the runs at the new fingerprint."
    },
    {
      "path": "docs/HANDOFF.md",
      "disposition": "updated",
      "reason": "Updated for CHG-20261021-002; the interpretation review gate is removed."
    },
    {
      "path": "CHANGELOG.md",
      "disposition": "updated",
      "reason": "Regenerated by docs sync."
    },
    {
      "path": "docs/current-state.json",
      "disposition": "updated",
      "reason": "Regenerated by docs sync."
    },
    {
      "path": "docs/FEATURES.md",
      "disposition": "updated",
      "reason": "Regenerated by docs sync."
    },
    {
      "path": "docs/WORKSPACE_QUALIFICATION.md",
      "disposition": "reviewed_unchanged",
      "reason": "Makes no statement about the design-system browser test bounds or the ADR 0017 approval that this change contradicts."
    },
    {
      "path": "docs/adr/0001-local-development-environment.md",
      "disposition": "reviewed_unchanged",
      "reason": "Makes no statement about the design-system browser test bounds or the ADR 0017 approval that this change contradicts."
    },
    {
      "path": "docs/adr/0002-application-foundation.md",
      "disposition": "reviewed_unchanged",
      "reason": "Makes no statement about the design-system browser test bounds or the ADR 0017 approval that this change contradicts."
    },
    {
      "path": "docs/audits/2026-10-06-project-audit.md",
      "disposition": "reviewed_unchanged",
      "reason": "Makes no statement about the design-system browser test bounds or the ADR 0017 approval that this change contradicts."
    },
    {
      "path": "docs/documentation-map.json",
      "disposition": "reviewed_unchanged",
      "reason": "Makes no statement about the design-system browser test bounds or the ADR 0017 approval that this change contradicts."
    },
    {
      "path": "docs/plans/2026-10-06-documentation-governance.md",
      "disposition": "reviewed_unchanged",
      "reason": "Makes no statement about the design-system browser test bounds or the ADR 0017 approval that this change contradicts."
    },
    {
      "path": "docs/plans/2026-10-10-boot-04-decision-worksheet.md",
      "disposition": "reviewed_unchanged",
      "reason": "Makes no statement about the design-system browser test bounds or the ADR 0017 approval that this change contradicts."
    },
    {
      "path": "docs/runbooks/design-system.md",
      "disposition": "reviewed_unchanged",
      "reason": "States the browser suite's scope and hinting setting, which are unchanged; the width bound is a test detail."
    },
    {
      "path": "docs/runbooks/workspace-setup.md",
      "disposition": "reviewed_unchanged",
      "reason": "Makes no statement about the design-system browser test bounds or the ADR 0017 approval that this change contradicts."
    },
    {
      "path": "docs/templates/change.json",
      "disposition": "reviewed_unchanged",
      "reason": "Schema/template unaffected: no record, artifact or evidence format changes."
    },
    {
      "path": "docs/validation/boot-01.md",
      "disposition": "reviewed_unchanged",
      "reason": "Makes no statement about the design-system browser test bounds or the ADR 0017 approval that this change contradicts."
    },
    {
      "path": "docs/vision/README.md",
      "disposition": "reviewed_unchanged",
      "reason": "Makes no statement about the design-system browser test bounds or the ADR 0017 approval that this change contradicts."
    },
    {
      "path": "docs/vision/additional_scope.csv",
      "disposition": "reviewed_unchanged",
      "reason": "Makes no statement about the design-system browser test bounds or the ADR 0017 approval that this change contradicts."
    },
    {
      "path": "docs/vision/initial_backlog.csv",
      "disposition": "reviewed_unchanged",
      "reason": "Makes no statement about the design-system browser test bounds or the ADR 0017 approval that this change contradicts."
    },
    {
      "path": "docs/vision/requirements.csv",
      "disposition": "reviewed_unchanged",
      "reason": "Makes no statement about the design-system browser test bounds or the ADR 0017 approval that this change contradicts."
    },
    {
      "path": "packages/design-system/README.md",
      "disposition": "reviewed_unchanged",
      "reason": "Makes no statement about the design-system browser test bounds or the ADR 0017 approval that this change contradicts."
    }
  ],
  "verification": [
    {
      "evidence": "docs/validation/runs/RUN-20261021-005.json",
      "outcome": "passed",
      "scope": "Configuration contract, workflow check, pnpm audit, typecheck, lint and full suite at fingerprint 52f4cc01."
    },
    {
      "evidence": "docs/validation/runs/RUN-20261021-006.json",
      "outcome": "passed",
      "scope": "Isolated design-system suite at the final fingerprint: 34 gates, 161/161."
    },
    {
      "evidence": "docs/validation/runs/RUN-20261021-007.json",
      "outcome": "passed",
      "scope": "docs:check over this record and the updated documents (static)."
    }
  ],
  "limitations": [
    "The foundation pipeline is not re-run locally: the only source change is a design-system browser test, which it does not execute; hosted CI runs both jobs."
  ],
  "next_actions": [
    "Push to pull request #5 and check both hosted jobs; the Director pushes the branch tip to main."
  ]
}
