{
  "schema_version": 1,
  "id": "CHG-20261023-001",
  "title": "UX-01: hosted run, Director review declined (D29) and design audit with Impeccable",
  "actor": "Claude Code agent (architect/QA reviewer role) on Director request, local WSL session",
  "status": "finalized",
  "recorded_at": "2026-10-23T02:11:00.726Z",
  "occurred_at": null,
  "event_time_basis": "recorded_only",
  "source_commit": "26b8f4e8b3495ace0b0d2ef63ee2b1aa611a061c",
  "task_ids": [
    "UX-01",
    "DOC-01",
    "DOC-02"
  ],
  "requirement_ids": [
    "R25.001",
    "R25.002",
    "R25.003"
  ],
  "feature_ids": [
    "F-DESIGN-SYSTEM",
    "F-DOCS"
  ],
  "changes": [
    {
      "kind": "review",
      "description": "Hosted run 39848720360 on pull request #7 (pull_request event) at 26b8f4e8b3495ace0b0d2ef63ee2b1aa611a061c concluded success: design-system job 2026-10-22T20:25:30Z to 20:34:33Z, foundation job 2026-10-22T20:25:30Z to 20:36:22Z. Public job metadata only; logs and artifacts were not downloaded."
    },
    {
      "kind": "documentation",
      "description": "Decision D29: the Director declined visual approval of the UX-01 reference screens (functional errors; lack of quality and uniqueness; generic stylization and requirements not followed; plain layouts in places and structure copied from the legacy app elsewhere) and instructed the agent to locate a tool that can hold it accountable for UX design, similar to Impeccable, and to audit the design and its own work. Recorded in docs/vision/decision_register.csv."
    },
    {
      "kind": "review",
      "description": "Design audit of 26b8f4e (docs/audits/2026-10-23-ux-01-design-audit.md): Impeccable engine v0.1.16 (Apache-2.0; linux-x64 binary SHA-256 a890a5b4b7d9d79ec54aa74612b5e924e5f5b422600a25fde8bcbda11b031787, matching the published checksum; run on the host with telemetry off) detector over 63 reference stories at four viewport and theme combinations, and its critique procedure run in a single context because sub-agents are not authorized; Hallmark static gates (MIT, 7ec8682); two Playwright functional walks in the dev container. Verdict: design specificity fails; compositions follow the legacy app; twelve functional defects (four P1); heuristics 23/40. Outputs stay in the ignored .local/ux-01-audit/."
    },
    {
      "kind": "revision",
      "description": "Two statements in the task 9 review against the section 33 criteria (CHG-20261022-013, docs/validation/ux-design-system.md) are wrong and are corrected by appended text: 'Legacy composition copied: none' (the deckbuilder, top bar, Collection and match compositions follow the legacy app) and 'every control acts within its story' (match Play only announces, every Challenge is rejected, inkwell placement is never available). The audit supersedes that review."
    },
    {
      "kind": "documentation",
      "description": "Status lines in AGENTS.md, README.md and docs/README.md, the UX-01 backlog status, the design and implementation plan status lines, the design-system validation and HANDOFF.md record the hosted run, D29 and the audit; the audit is classified as evidence in docs/documentation-map.json."
    }
  ],
  "files": [
    "AGENTS.md",
    "CHANGELOG.md",
    "README.md",
    "docs/HANDOFF.md",
    "docs/README.md",
    "docs/audits/2026-10-23-ux-01-design-audit.md",
    "docs/changes/CHG-20261023-001.json",
    "docs/current-state.json",
    "docs/documentation-map.json",
    "docs/plans/2026-10-22-ux-01-design.md",
    "docs/plans/2026-10-22-ux-01-implementation.md",
    "docs/validation/logs/RUN-20261023-001.txt",
    "docs/validation/logs/RUN-20261023-002.txt",
    "docs/validation/runs/RUN-20261023-001.json",
    "docs/validation/runs/RUN-20261023-002.json",
    "docs/validation/ux-design-system.md",
    "docs/vision/decision_register.csv",
    "docs/vision/initial_backlog.csv"
  ],
  "documentation_reviews": [
    {
      "path": "docs/audits/2026-10-23-ux-01-design-audit.md",
      "disposition": "updated",
      "reason": "New dated audit of the UX-01 reference screens at 26b8f4e, classified as evidence."
    },
    {
      "path": "docs/validation/ux-design-system.md",
      "disposition": "updated",
      "reason": "Appended section: hosted run 39848720360, the Director's review (D29), the audit summary and corrections to the task 9 review."
    },
    {
      "path": "docs/vision/decision_register.csv",
      "disposition": "updated",
      "reason": "Adds D29, the Director's review declining visual approval and the accountability-tool and audit instruction."
    },
    {
      "path": "docs/vision/initial_backlog.csv",
      "disposition": "updated",
      "reason": "UX-01 status becomes reference screens declined by the Director, audit recorded, remediation pending; links the audit and this record."
    },
    {
      "path": "docs/plans/2026-10-22-ux-01-implementation.md",
      "disposition": "updated",
      "reason": "Status line records task 10's hosted run and D29."
    },
    {
      "path": "docs/plans/2026-10-22-ux-01-design.md",
      "disposition": "updated",
      "reason": "Status line records D29 and the audit's finding that the design specified components and states but no visual world."
    },
    {
      "path": "docs/documentation-map.json",
      "disposition": "updated",
      "reason": "Classifies the new audit as evidence with no source edges."
    },
    {
      "path": "docs/HANDOFF.md",
      "disposition": "updated",
      "reason": "Rewritten for this checkpoint: audit result, the accountability tool, pending Director decisions and next actions."
    },
    {
      "path": "AGENTS.md",
      "disposition": "updated",
      "reason": "UX-01 status paragraph records the hosted run, D29 and the audit."
    },
    {
      "path": "README.md",
      "disposition": "updated",
      "reason": "UX-01 status paragraph records the hosted run, D29 and the audit."
    },
    {
      "path": "docs/README.md",
      "disposition": "updated",
      "reason": "UX-01 status paragraph records the hosted run, D29 and the audit."
    },
    {
      "path": "docs/adr/0017-technical-design-system.md",
      "disposition": "reviewed_unchanged",
      "reason": "The amendment records what was built; adopting Impeccable as a gate would amend it, and that awaits the Director."
    },
    {
      "path": "docs/runbooks/design-system.md",
      "disposition": "reviewed_unchanged",
      "reason": "No operational procedure changes until the Director decides on the accountability tool."
    },
    {
      "path": "docs/FEATURES.md",
      "disposition": "reviewed_unchanged",
      "reason": "F-DESIGN-SYSTEM's implemented scope and evidence are unchanged; no source changed."
    },
    {
      "path": "docs/features.json",
      "disposition": "reviewed_unchanged",
      "reason": "No source changed, so feature evidence stays bound to the current fingerprint."
    }
  ],
  "verification": [
    {
      "evidence": "docs/validation/runs/RUN-20261023-001.json",
      "outcome": "passed",
      "scope": "docs:check over the finalized documentation-only checkpoint (static); no source changed, so the source fingerprint and feature evidence are unchanged. Taken before HANDOFF.md's record time was filled in; RUN-20261023-002 covers the final documents."
    },
    {
      "evidence": "docs/validation/runs/RUN-20261023-002.json",
      "outcome": "passed",
      "scope": "docs:check over the final documents of this documentation-only checkpoint (static), after HANDOFF.md's record time was filled in."
    }
  ],
  "limitations": [
    "The Impeccable critique ran in a single context (degraded by its own definition) because sub-agents are not authorized in this session; its design review was written before the detector output was read, except one trial scan of the deckbuilder.",
    "Impeccable and Hallmark ran on the WSL host from the session scratchpad, not inside the Dev Container, so their outputs are host review evidence and not evidence:run receipts; the functional walks ran in the container but are review scripts, not committed tests.",
    "Screenshots, walk logs and detector JSON stay in the ignored .local/ux-01-audit/ and are not committed.",
    "Hosted run 39848720360 is recorded from public job metadata; logs and artifacts were not downloaded."
  ],
  "next_actions": [
    "The Director decides whether Impeccable becomes a project gate (ADR 0017 amendment) and whether sub-agents may run independent design critiques.",
    "The Director chooses the UX-01 remediation path and the source of the ink-form artwork; the agent records the decisions and follows the documented stages.",
    "Main stays at 4d9dfc7; pull request #7 is not merged as it stands."
  ]
}
