{
  "schema_version": 1,
  "id": "CHG-20261010-005",
  "title": "Record Director D07 asset decision, fan-content notice and BOOT-04 sign-off",
  "actor": "Claude Code agent (architect/developer role) on Director request, local WSL session",
  "status": "finalized",
  "recorded_at": "2026-10-10T21:31:16.285Z",
  "occurred_at": null,
  "event_time_basis": "recorded_only",
  "source_commit": "a810bfd07eac05a87ccbf0a8b5ea4fa77a8af274",
  "task_ids": [
    "BOOT-04",
    "DOC-01",
    "DOC-02"
  ],
  "requirement_ids": [],
  "feature_ids": [
    "F-STAGING",
    "F-DOCS"
  ],
  "changes": [
    {
      "kind": "documentation",
      "description": "Record the Director's D07 decision (2026-10-10): use all planned Disney Lorcana assets, card art and images in full under Ravensburger fan-content terms, with the required notice and no charges for use or access. New current docs/policies/fan-content.md holds the verbatim notice and its placement (README now; web app before any official asset is shown outside local development; published media), plus the no-payment, no-endorsement, per-asset provenance and takedown-readiness rules."
    },
    {
      "kind": "review",
      "description": "Checked the policy URL in the notice: it resolves to Ravensburger's Community Code PDF (conduct policy, effective 2023-05-10), which does not itself state fan-content permissions or the notice. The brand-portal Fan Content Policy could not be read automatically. This verification gap and the revocation risk (Community Code sole discretion; Pixelborn 2024) are recorded; the decision is the Director's."
    },
    {
      "kind": "revision",
      "description": "Record the BOOT-04 §12 sign-off: all items accepted; purchase-specific items (domain/D01, payment methods, purchase) execute when the first staging deploy is ready. Update the worksheet status/§2/§12, ADR0007 status, BOOT-04 validation, F-STAGING, the backlog status, decision register D02/D03/D07, the AGENTS.md asset boundary, the README notice, the indexes and the handoff."
    },
    {
      "kind": "test",
      "description": "Local Dev Container RUN-20261010-011 pnpm verify and RUN-20261010-012 test:documentation passed on the draft snapshot (clock drift 0 ms; executable fingerprint unchanged)."
    }
  ],
  "files": [
    "AGENTS.md",
    "CHANGELOG.md",
    "README.md",
    "docs/FEATURES.md",
    "docs/HANDOFF.md",
    "docs/README.md",
    "docs/adr/0007-hosting-provider-baseline.md",
    "docs/changes/CHG-20261010-005.json",
    "docs/current-state.json",
    "docs/documentation-map.json",
    "docs/features.json",
    "docs/plans/2026-10-10-boot-04-decision-worksheet.md",
    "docs/policies/fan-content.md",
    "docs/validation/boot-04.md",
    "docs/validation/logs/RUN-20261010-011.txt",
    "docs/validation/logs/RUN-20261010-012.txt",
    "docs/validation/runs/RUN-20261010-011.json",
    "docs/validation/runs/RUN-20261010-012.json",
    "docs/vision/README.md",
    "docs/vision/decision_register.csv",
    "docs/vision/initial_backlog.csv"
  ],
  "documentation_reviews": [
    {
      "path": "docs/policies/fan-content.md",
      "disposition": "updated",
      "reason": "New current policy with the Director-supplied notice verbatim; placement and rules derived from the decision. Verification limits match the retrieved Community Code PDF and the unreadable brand portal."
    },
    {
      "path": "docs/plans/2026-10-10-boot-04-decision-worksheet.md",
      "disposition": "updated",
      "reason": "§12 checked off per the Director, with purchase items marked at purchase; status and §2 record the sign-off and D07. Decisions otherwise unchanged."
    },
    {
      "path": "docs/vision/decision_register.csv",
      "disposition": "updated",
      "reason": "D02 durability and D03 region accepted; D07 records the Director decision with privacy terms still open. Other rows unchanged."
    },
    {
      "path": "docs/vision/initial_backlog.csv",
      "disposition": "updated",
      "reason": "BOOT-04 status now records the sign-off; deployment configuration still pending."
    },
    {
      "path": "docs/validation/boot-04.md",
      "disposition": "updated",
      "reason": "Current status reflects the recorded sign-off and D07; deployment configuration remains open."
    },
    {
      "path": "docs/adr/0007-hosting-provider-baseline.md",
      "disposition": "updated",
      "reason": "Status line: sign-off recorded; purchase deferred."
    },
    {
      "path": "AGENTS.md",
      "disposition": "updated",
      "reason": "The asset boundary now reflects D07: official assets permitted with provenance, notice, no charges and neutral fallback; synthetic fixtures remain for tests."
    },
    {
      "path": "README.md",
      "disposition": "updated",
      "reason": "Adds the required fan-content notice (subject 'This project') and a link to the policy."
    },
    {
      "path": "docs/README.md",
      "disposition": "updated",
      "reason": "BOOT-04 row notes the recorded sign-off; new fan content policy row."
    },
    {
      "path": "docs/vision/README.md",
      "disposition": "updated",
      "reason": "Records the sign-off and the D07 decision."
    },
    {
      "path": "docs/FEATURES.md",
      "disposition": "updated",
      "reason": "F-STAGING limits: sign-off recorded; capacity/restore evidence still pending."
    },
    {
      "path": "docs/features.json",
      "disposition": "updated",
      "reason": "F-STAGING description: sign-off recorded; purchase deferred; still planned/pending."
    },
    {
      "path": "docs/HANDOFF.md",
      "disposition": "updated",
      "reason": "Session handoff for the D07/sign-off change, including the outside branch switch observed in the reflog."
    },
    {
      "path": "docs/adr/0008-engine-placement-dependency-baseline.md",
      "disposition": "reviewed_unchanged",
      "reason": "Engine/dependency decisions unaffected by asset rights."
    },
    {
      "path": "docs/vision/Development_Blueprint_2026-10-05.md",
      "disposition": "historical_preserved",
      "reason": "The planning snapshot keeps its original D07 recommendation; the decision register and policy record the change."
    }
  ],
  "verification": [
    {
      "evidence": "docs/validation/runs/RUN-20261010-011.json",
      "outcome": "passed",
      "scope": "pnpm verify (configuration/syntax/documentation consistency) in the local Dev Container; unchanged executable fingerprint. Validates consistency, not legal sufficiency of the asset policy."
    },
    {
      "evidence": "docs/validation/runs/RUN-20261010-012.json",
      "outcome": "passed",
      "scope": "Documentation/evidence regression suite in the local Dev Container."
    }
  ],
  "limitations": [
    "Documentation only: no executable change; the web-app notice display is a later UX/WEB acceptance gate.",
    "The Ravensburger Fan Content Policy page itself was not readable automatically; it must be re-read and recorded before public launch. Not legal advice.",
    "No purchase, account, domain, DNS or deployment; purchase-specific checklist items execute later."
  ],
  "next_actions": [
    "Director authorizes publishing and merging claude/boot-04-signoff-d07.",
    "RULE-01 source inventory including asset provenance fields.",
    "UX/WEB: render the required notice before showing official assets outside local development."
  ]
}
