{
  "schema_version": 1,
  "id": "CHG-20261019-001",
  "title": "Clock controlled test step 1: Ubuntu systemd-timesyncd stopped by the Director, 20-minute settle measurement",
  "actor": "Claude Code agent (architect/QA reviewer role) on Director request, local WSL session",
  "status": "finalized",
  "recorded_at": "2026-10-19T01:54:56.958Z",
  "occurred_at": null,
  "event_time_basis": "recorded_only",
  "source_commit": "9a036329602ce0ef0759aa72ef54e9427b971e1d",
  "task_ids": [
    "BOOT-03",
    "DOC-01",
    "DOC-02"
  ],
  "requirement_ids": [
    "R29.007"
  ],
  "feature_ids": [
    "F-DOCS",
    "F-CI"
  ],
  "changes": [
    {
      "kind": "review",
      "description": "Clock controlled test step 1 (admin, Director-run command). The Director stopped Ubuntu systemd-timesyncd at 2026-10-19T00:58:41Z (systemd InactiveEnterTimestamp); it stays enabled. A read-only host settle logger (adjtimex modes=0; REALTIME/MONOTONIC/MONOTONIC_RAW every 0.1 s) ran 1,200 s from 00:59:33Z. Calendar steps became single (29 steps, one per ~29.8 s, no second timesyncd step) and shrank from -660.6 ms to -5.4 ms; none above 5 ms after 846 s. chronyd's applied correction fell from +27,140 ppm (tick 10271) to tick 10001 and about +50 ppm by about 15 minutes; the measured monotonic-versus-raw rate over each of the last 15 intervals was 42-55 ppm. No WSL restart was needed (plan step 2 skipped)."
    },
    {
      "kind": "review",
      "description": "Second read-only host window, 1,200 s from 01:34:25Z, after the pipeline run: no calendar step above 5 ms, calendar minus monotonic -52.0 ms in total (plan limit 1 s), tick steady at 10001, measured correction 27-50 ppm (median 42). Acceptance: the 20-minute window and the long exact-timing receipt are met; the sleep/wake re-check is open."
    },
    {
      "kind": "test",
      "description": "RUN-20261019-001 read-only kernel clock probe in the container, 120 s: passed with exact timing (no clock discontinuity); tick 10001, applied +49 to +58 ppm, no calendar step above 50 ms, calendar minus monotonic -6.4 ms, chronyd estimated error 99 microseconds (49,691 at the start of the settle window)."
    },
    {
      "kind": "test",
      "description": "RUN-20261019-002 local isolated BOOT-03 pipeline (python3 scripts/ci-local.py, disposable project lorcana-ci-6e031bdeb09240df88ca1c0fa835dd44): passed every stage in 461.7 s with exact timing, covering frozen install, 408 Node tests in 20 suites, upstream engine 406 passed/1 skipped, 2 injection tests, Python tooling, disposable PostgreSQL 18 provisioning, 11 Chromium tests, both secret scans, artifact verification and cleanup. Log reviewed: no credential patterns. Local isolated runs RUN-20261012-089/091, RUN-20261013-011/113 and RUN-20261014-051 had failed clock_changed."
    },
    {
      "kind": "documentation",
      "description": "Clock investigation section 'Controlled test step 1 \u2014 2026-10-19 UTC'; dated clock notes appended to the current-status paragraphs of AGENTS.md, README.md and docs/README.md; handoff rewritten."
    }
  ],
  "files": [
    "AGENTS.md",
    "CHANGELOG.md",
    "README.md",
    "docs/HANDOFF.md",
    "docs/README.md",
    "docs/changes/CHG-20261019-001.json",
    "docs/current-state.json",
    "docs/validation/clock-investigation.md",
    "docs/validation/logs/RUN-20261019-001.txt",
    "docs/validation/logs/RUN-20261019-002.txt",
    "docs/validation/logs/RUN-20261019-003.txt",
    "docs/validation/runs/RUN-20261019-001.json",
    "docs/validation/runs/RUN-20261019-002.json",
    "docs/validation/runs/RUN-20261019-003.json"
  ],
  "documentation_reviews": [
    {
      "path": "CHANGELOG.md",
      "disposition": "updated",
      "reason": "Regenerated by docs sync."
    },
    {
      "path": "docs/current-state.json",
      "disposition": "updated",
      "reason": "Regenerated by docs sync."
    },
    {
      "path": "docs/validation/clock-investigation.md",
      "disposition": "updated",
      "reason": "Dated section: step 1 result, settle table, receipts and open items; earlier evidence unchanged."
    },
    {
      "path": "AGENTS.md",
      "disposition": "updated",
      "reason": "Dated note: local receipts have exact timing again after the timesyncd stop; leave it stopped; persistence pending."
    },
    {
      "path": "README.md",
      "disposition": "updated",
      "reason": "Same dated clock note as AGENTS.md."
    },
    {
      "path": "docs/README.md",
      "disposition": "updated",
      "reason": "Same dated clock note as AGENTS.md."
    },
    {
      "path": "docs/HANDOFF.md",
      "disposition": "updated",
      "reason": "Rewritten for this checkpoint."
    },
    {
      "path": "docs/DEVELOPMENT_WORKFLOW.md",
      "disposition": "reviewed_unchanged",
      "reason": "Its rule (no Windows/WSL clock changes without Director authorization) still holds; the stop was Director-run under the admin assignment."
    },
    {
      "path": "docs/runbooks/ci.md",
      "disposition": "reviewed_unchanged",
      "reason": "Local isolated launcher used exactly as documented; procedure unchanged."
    }
  ],
  "verification": [
    {
      "evidence": "docs/validation/runs/RUN-20261019-001.json",
      "outcome": "passed",
      "scope": "Read-only kernel clock probe after timesyncd was stopped; first container receipt with exact timing since the step problem began."
    },
    {
      "evidence": "docs/validation/runs/RUN-20261019-002.json",
      "outcome": "passed",
      "scope": "Local isolated BOOT-03 pipeline on the current source with exact timing; first local isolated timing-valid pass since RUN-20261012-043."
    },
    {
      "evidence": "docs/validation/runs/RUN-20261019-003.json",
      "outcome": "passed",
      "scope": "docs:check over this record and the updated documents (static)."
    }
  ],
  "limitations": [
    "The settle logs are host observations on WSL Ubuntu (same kernel), summarized in the clock investigation, not recorder receipts.",
    "systemd-timesyncd remains enabled; a WSL restart or reboot restarts it until the Director disables it.",
    "No sleep/wake re-check yet; Windows remains about 0.54 s from Internet time (absolute UTC, not elapsed time).",
    "RUN-20261019-002 qualifies the current source only, not earlier sources whose local isolated timing stayed pending."
  ],
  "next_actions": [
    "Director runs sudo systemctl disable systemd-timesyncd in an Ubuntu terminal (or PowerShell wsl -d Ubuntu -u root ...).",
    "Reviewer re-measures after the next sleep/wake.",
    "Merge claude/admin-clock-and-fixtures to main after hosted CI, with Director permission.",
    "Codex implements D13; reviewer re-audits."
  ]
}
