{
  "schema_version": 1,
  "id": "CHG-20261019-002",
  "title": "Clock fix made persistent, hosted PLAY-04 merge runs recorded, Director decision D14 (keep the engine's timeout restore)",
  "actor": "Claude Code agent (architect/QA reviewer role) on Director request, local WSL session",
  "status": "finalized",
  "recorded_at": "2026-10-19T05:49:12.691Z",
  "occurred_at": null,
  "event_time_basis": "recorded_only",
  "source_commit": "ea3a6b7e282aa2adb78be1dc003a82ac46478954",
  "task_ids": [
    "PLAY-04",
    "BOOT-03",
    "DOC-01",
    "DOC-02"
  ],
  "requirement_ids": [
    "R29.007"
  ],
  "feature_ids": [
    "F-DOCS",
    "F-MATCH-CLOCKS",
    "F-CI"
  ],
  "changes": [
    {
      "kind": "review",
      "description": "Clock plan step 3: the Director ran sudo systemctl disable systemd-timesyncd. At 2026-10-19T02:40:06Z it was disabled and inactive; read-only 60 s probes at 02:40Z and about 05:50Z showed tick 10001/10000, +35.6/+48.7 ppm, no step, calendar minus monotonic -2.3/-3.3 ms, kernel suspend time 0 s. The sleep/wake re-check remains open."
    },
    {
      "kind": "test",
      "description": "RUN-20261019-004: public GitHub metadata for Foundation runs 39108811073 (claude/play-04-opening-fix-audit, workflow_dispatch, attempt 1 success, job 07:44:46-07:57:00Z) and 39109642662 (main, push, attempt 1 success, job 07:58:20-08:10:19Z), both at 4dea392 with every step successful; no logs or artifacts downloaded."
    },
    {
      "kind": "review",
      "description": "Director decision D14 recorded: keep the engine's existing replenishment after a timeout (an exhausted pass restores the normal reset, 125 s with qualification values, versus 66 s after a pass with 1 s left); revisit if abuse appears. PLAY-04 audit policy points: 1 remains engine behaviour (and D13 makes repeated timeouts a loss), 2 kept by D14, 3 replaced by D13, 4 open for operations."
    },
    {
      "kind": "documentation",
      "description": "Decision register D14; PLAY-04 validation note (hosted runs, D14, policy points); clock investigation persistence note; dated notes in AGENTS.md, README.md and docs/README.md; PLAY-04 backlog status synthetic_acceptance_reaudited_merged_hosted_pass_d13_pending; handoff rewritten."
    }
  ],
  "files": [
    "AGENTS.md",
    "CHANGELOG.md",
    "README.md",
    "docs/HANDOFF.md",
    "docs/README.md",
    "docs/changes/CHG-20261019-002.json",
    "docs/current-state.json",
    "docs/validation/clock-investigation.md",
    "docs/validation/logs/RUN-20261019-004.txt",
    "docs/validation/logs/RUN-20261019-005.txt",
    "docs/validation/play-04.md",
    "docs/validation/runs/RUN-20261019-004.json",
    "docs/validation/runs/RUN-20261019-005.json",
    "docs/vision/decision_register.csv",
    "docs/vision/initial_backlog.csv"
  ],
  "documentation_reviews": [
    {
      "path": "CHANGELOG.md",
      "disposition": "updated",
      "reason": "Regenerated by docs sync."
    },
    {
      "path": "docs/current-state.json",
      "disposition": "updated",
      "reason": "Regenerated by docs sync."
    },
    {
      "path": "docs/vision/decision_register.csv",
      "disposition": "updated",
      "reason": "D14 recorded with timestamp and scope."
    },
    {
      "path": "docs/validation/play-04.md",
      "disposition": "updated",
      "reason": "Dated note: hosted merge runs, D14 and the status of the four audit policy points."
    },
    {
      "path": "docs/validation/clock-investigation.md",
      "disposition": "updated",
      "reason": "Dated persistence note with the post-disable probes; earlier evidence unchanged."
    },
    {
      "path": "docs/vision/initial_backlog.csv",
      "disposition": "updated",
      "reason": "PLAY-04 is merged with hosted passes recorded; D13 follow-up pending."
    },
    {
      "path": "AGENTS.md",
      "disposition": "updated",
      "reason": "Dated note: clock fix persistent, hosted runs recorded, D14."
    },
    {
      "path": "README.md",
      "disposition": "updated",
      "reason": "Same dated note as AGENTS.md."
    },
    {
      "path": "docs/README.md",
      "disposition": "updated",
      "reason": "Same dated note as AGENTS.md."
    },
    {
      "path": "docs/HANDOFF.md",
      "disposition": "updated",
      "reason": "Rewritten for this checkpoint."
    },
    {
      "path": "docs/adr/0016-durable-engine-clocks.md",
      "disposition": "reviewed_unchanged",
      "reason": "D14 keeps the implemented timeout restore, so the clock decision is unchanged; D13's revision belongs to Codex's implementation."
    },
    {
      "path": "docs/runbooks/game-clocks.md",
      "disposition": "reviewed_unchanged",
      "reason": "Behaviour unchanged by D14."
    }
  ],
  "verification": [
    {
      "evidence": "docs/validation/runs/RUN-20261019-004.json",
      "outcome": "passed",
      "scope": "Public GitHub job/step metadata for the two PLAY-04 merge runs at 4dea392; metadata only."
    },
    {
      "evidence": "docs/validation/runs/RUN-20261019-005.json",
      "outcome": "passed",
      "scope": "docs:check over this record and the updated documents (static)."
    }
  ],
  "limitations": [
    "Hosted runs are observed through public metadata; logs and artifacts were not downloaded, so no fresh hosted test count is claimed.",
    "The post-disable probes are host observations, not recorder receipts; the sleep/wake re-check is not done.",
    "The hosted run for this branch's own pull request cannot be recorded in this commit; it is recorded at the next checkpoint."
  ],
  "next_actions": [
    "Open the pull request, check its hosted Foundation run and fast-forward main when it passes.",
    "Director assigns Codex the D13 brief, updated for the new main; reviewer re-audits.",
    "Re-check the clock after the next sleep/wake."
  ]
}
